Business Name,Address,Phone,Website,G+ URL,Rating,Categories,Reviews
Titan Roofing, LLC,21750 Hardy Oak Blvd Suite 102, San Antonio, TX 78258, USA,+1 210-338-8141,http://www.gotitanroofs.com/,https://maps.google.com/?cid=2381582716444999038,5,roofing_contractor, general_contractor, point_of_interest, establishment,itan roofing did a great job with our home. Chris, Adam and thier crew were awesome to work with! Thank you!!!,We live 1400 miles away from San Antonio, but bought a house in Boerne. We realized that we might encounter some drawbacks buying a home so far away, and not being familiar with the people and services provided in the area. The home was 18 years old and the inspectors said the roof was still good, but due to the age it did have some issues. .So it was our decision to have the roof replaced rather than wait until problems might occur.Using the Internet we obtained a number of proposals and used the BBI and vendor website reviews (5 Star) to help evaluate the area roofers.  One of the top companies that kept coming up was Titan Roofing whose owner Christopher Fentress who personally contacted us.  To make a long story short Christopher followed through with  everything and was very helpful throughout the whole process. His communications was impeccable. His people were on time, the job completed as promised and the project was cleaned up spottlessly.  We are pleased to write a positive review and have absolutely no complaints.,Now, I know why Titan has great reviews.  Chris and his crew are awesome.  When I first contacted the company, Chris immediately came out and looked at the roof.  He answered all my questions.  Best part, all the other companies insisted on knowing how much my insurance was giving for the claim, not Chris.  He gave me a quote which included more than we even expected.  To me, that showed he was fair and not trying to take advantage of my insurance company.  Chris is a genuine businessman with integrity. .  His crew is some of the hardest working individuals I have ever seen.  They were respectful and polite.  Our roof looks great and we are very happy with it.  In fact, people keep driving by and looking at what a great job they did.  Chris, also, was out ensuring everything was done correctly.  However, with his crew, they were superb even in the horrible heat we had in July.  We had to have some plywood replaced and Chris is even coming back on a Sunday to paint it.  ***Update:  Chris did come back and paint.  He is definitely a man of his word!Thank you Chris and the wonderful crew.  If we ever need roofing again, we are surely going to call Titan.,I had several companies come out and give me estimates for my roof from hail damage. Several companies tried explaining and justifying the cost of the roof by stating they used a better quality of material. Titan Roofing used material that matched or surpassed the quality of material other companies were going to use. And the cost of the roof with Chris' company, Titan was substantially cheaper than others had quoted. They came out and started working on my roof on the day they stated they would start. Chris stated the crew would start around 0800.  My doorbell rang at 0805.  I was surprised they were on time. Other contractors that have done work for me have always been running behind schedule.  I called Chris about a concern I had during the first day.  My concern was addressed promptly and I was reassured the finish product would be exactly what I expected and more. Chris was always a pleasurable and professional person to work with. After my roof was done, I must admit I was very pleased with the way it came out.  The attention to the small details on the roof really set my house apart from the ones around us.  The high definition roof added so much to curb appeal. I highly recommend Titan Roofing to anyone looking for a reputable company.,Chris and Titan Roofing  did a great job and exceeded our expectations. Our roof was damaged by last year's storms and Chris was quick to respond and to get the ball rolling. He dealt with the insurance claim without a snag or complaint and our roof was done perfectly. We couldn't be happier with the results and the overall experience.
Stephens Roofing & Remodeling,11230 West Ave #2201, San Antonio, TX 78213, USA,+1 210-785-0994,http://www.stephensroofing.net,https://maps.google.com/?cid=2801469508374838983,4.3,general_contractor, roofing_contractor, point_of_interest, establishment,roof came out fantastic, would use them again and recommend them to friends, friendly, professional, cleaned up after job. totally satisfied , thank you,  alissa hunt,Professional from the start. Estimate was fast and fairly priced. No scheduling issues. Pics were great for our records.  Highly recommend. ,Thank you very much for a great work on my roof. Yall are life savers.! Will recommend to everyone.,They replaced a functional roof with a brand new roof, but they didn't seal it properly around the flashing and created a leak. They repaired their mistake but didn't repair the damage to the inside, now I'm left with a bill for the roof and a bill for repairs for inside, and Stevens is threatening me with a lien while repairs are still being done due to their mistake.On top of all the recent stuff, Stevens took over 6 months from contract signing to deliver the roofing and to start work, but that was a bit expected. However, it wasn't expected that they would deliver the roofing material to the roof without notice, just one day you come home with a metric ton of trash on the roof and no notice. A waste of a company, go with someone else if you have a chance.,I've worked with this company and  seen the work that they have done its very good and I can recomend you working with them.
Priced Right Roofing Co,507 S General McMullen Dr, San Antonio, TX 78237, USA,+1 210-767-3513,http://www.sanantoniotxroofing.com/,https://maps.google.com/?cid=5190246895576447485,1,roofing_contractor, point_of_interest, establishment,here are always two sides to a story, and of course, pros and cons to each company. I've heard that this company does well when it comes to getting their job done. However, as important performance is, it is as important to me that a company has a good professionalism. Long story short, when I started pressing Ray (the owner of Priced Right Roofing) about lying to me, he wanted to "throw down" and explained to me he doesn't know how it is like where I came from, but in Texas, they do it differently.To explain further, while they were working on the roof, I was affected by having my AC turned off. Understanding that it is not their fault that the AC got turned off, I wanted to know what happened that made me suffer through a night in a 90 degree room. When I first brought up the issue to the owner (Ray) of Priced Right Roofing, he instantly replied by stating that it is not their fault. Explaining to him that it would have made sense that before leaving at the end of the day, that they check that all the ACs are connected (since the ACs could get disconnected as they moved the wires around to continue their work). Many times throughout the conversation, his story kept changing. He said that all the ACs are connected, and that they should run fine. Then, he said that a switch might have been turned off. Thinking that he was referring to a breaker, i told him that I had it turned off and back on and still doesn't work. Then, he said that the switch is inside the building, where the building management would know where it is (and I spoke to the maintenance people, and found out that the "switch" doesn't exist). Frustrated about this lies, I had to go on the roof myself to see what was going on. That's when I found out that one of the ACs was broken. When i asked Ray's employee, i was told that the AC broke yesterday, and he let Ray know. Once I started confronting Ray about this, he started to change the subject and said that he would "throw down". There are many things that went wrong here. But, what I really hope to achieve is that others don't go through this awful experience. I am glad that I found out that the AC was broken from the employee. If not, who knows Ray would have dumped the expense of fixing the AC to my building management.
Roofing contractors San Antonio| Metal Roofing,1440 W Bitters Rd #1125, San Antonio, TX 78248, USA,+1 210-762-6011,http://www.tileroofingsanantonio.com/,https://maps.google.com/?cid=11463322150193880069,4.8,roofing_contractor, general_contractor, point_of_interest, establishment, had a small leak in my tile roofing these guys came out and did a estimate for and discovered there was much more damage that our insurance company then paid for. I thought I was gonna have a large out-of-pocket however it was relatively small after they got my roof paid for by the insurance company. I appreciated their professionalism and experience it ended up saving me thousands of dollars.,We found some really cool Barrel tiles that we wanted to use for our new property and these guys were able to match the exact product that was very difficult for us to find and installed it on our new home. We couldn't be happier with it it even has a look that reminds us of the Italian home that we stayed at.,After the storm I had some damage do to the fact a large tree fell on some of the large concrete tiles on my roof. The guys came out right away gave me a fair price and where able to fix it quickly.,The owner, is friendly and knowledgeable. I highly recommend him,I am managing an estate for a family friend in the San Antonio area and recently needed to find a contractor that specialized in not only tile but high-end composite tiles to retrofit an older historical home with very discriminating needs. One of the Consultants from tile roofing of San Antonio came out and met with myself and my homeowner. They were very knowledgeable and even had some swatches of the materials for suggestions. The project went really well and the price was appropriate for the level of work we were having them do. My client was very happy with the end result and more importantly the price. My particular client is a very challenging one to please, so well done guys.
Better Roofing USA Inc,3206 Clark Ave, San Antonio, TX 78210, USA,+1 210-971-8684,http://www.betterroofingusainc.com/,https://maps.google.com/?cid=12500954077808880880,4.3,roofing_contractor, point_of_interest, establishment,Arturo Gonzales was very polite, understanding, and explained every process of the job being performed.  My husband ordered the forest green shingles and I love the way the roof looks.  Awesome job.  I was a bit nervous, but Arturo was very kind and very professional.  Thank you!,The work that the guys did was good, the process it took was frustrating, for one your drinking on the job and decide to discard beer cans on my yard. Then you go take a piss behind the neighbors building when there is a store across the street. Finally when it's done you leave nails all over my driveway, i don't want to pay for new tires and i don't want my kids to get hurt, by a Damn magnet!,Mike and his team were very professional.  Work was done quickly and clean up was amazing.  Want to thank Arturo Gonzales who was professional and courteous in answering questions I had.  I highly recommend Better Roofing USA to anyone.,Phil and his team were very professional and knowledgable. They got our roofing job done quickly and left our home clean and respected. Their price was also very competitive. I would recommend Better Roofing to anyone.,Tony and his team were very reliable and professional, the experience I had with Better Roofing was great. They did a great job roofing my house. Excellent.
West End Roofing, Siding & Windows, A Beacon Roofing Supply Company,1952 Shipman Dr, San Antonio, TX 78219, USA,+1 210-271-9961,http://www.westendroofing.com/,https://maps.google.com/?cid=5978128376023475573,,roofing_contractor, home_goods_store, store, point_of_interest, establishment,
SA DISCOUNT ROOFING AND REPAIRS,459 Saipan Pl, San Antonio, TX 78221, USA,+1 210-427-2452,http://discountroofing.org/,https://maps.google.com/?cid=7847439096035138414,3.5,roofing_contractor, point_of_interest, establishment,iscount Roofing. And Rick Ellis and his team did our roof & gutter in September and were great. They were very professional and did an excellent job. Came in early morning and were done by the late afternoon. Would highly recommend Discount  Roofing for any work that needs to be done.David brown
M & M Roofing, Siding & Windows,3501 W Commerce St, San Antonio, TX 78207, USA,+1 210-822-6070,http://www.mmroofsidingsanantonio.com/,https://maps.google.com/?cid=4678063903510820946,4.9,roofing_contractor, general_contractor, point_of_interest, establishment,Chris Traweek was my estimator.  I highly recommend you ask specifically for him through M&M Roofing.  You won't be disappointed.  He's very honest, sincere, and helpful.  I had heard about M&M Roofing on a radio talk show about 10 years ago and wrote down their name.  After a hail storm, I finally had a chance to call them.  Chris listened to my concerns and ideas I had in remodel my home and was very helpful in providing guidance.  He worked with me during the construction process and even allowed me some time to extract insulation from my attic during the re-decking of my roof with Tech Shield Radiant Barrier (I highly recommend this product...big difference in attic and home temperatures).  His roofing crew was very professional and had tons of experience.  M&M Roofing never 'hounded' me for money and waited until the entire project, including gutter installation, was completed before requesting payment....$12k+ job.  They never even asked for any money up front. Highly recommend!!,Highly recommend this company for vinyl siding work and trim work.  Our project manager, Chance Lyons was prompt on arrival, and gave us a very fair price to completely re-face our bay window with vinyl siding, and fix some trim work along our roof line.  Chance was great, and his crew was just as great.  Very polite and professional and the results were outstanding!  Thanks Chance, and M & M Roofing, Siding, & Windows for a job, well done!,Prompt service, good work and friendly crew. I received an estimate the day the project manager came out to look at our roof. We also looked in to having our trim updated and house painted as well. The price was right and we're happy with the results.,Chris Traweek and his crew were very professional and did an amazing job replacing our roof.  They delivered the shingles when they said they would be delivered and completed the roof ahead of schedule while maintaining a safe and clean job site while working. Chris communicated with us throughout the entire process and was present daily as well as returning to walk the entire roof after it was completed.  I am very happy with the service and professionalism of both M & M Roofing and Chris Traweek.  I highly recommend M & M Roofing!,Chris Traweek of M&M roofing provided excellent service and was in constant contact before, during and after the completion of the roofing project.  I would highly recommend M&M roofing and ask for Chris.
Alamo Roofers, Inc.,1411 W Hildebrand Ave, San Antonio, TX 78201, USA,+1 210-735-3021,http://www.alamoroofers.com/,https://maps.google.com/?cid=17285521818511065034,,roofing_contractor, point_of_interest, establishment,
Kidd Roofing,2415 Boardwalk St, San Antonio, TX 78217, USA,+1 210-832-8241,http://www.kiddroof.com/,https://maps.google.com/?cid=7407819892379118713,4.3,roofing_contractor, point_of_interest, establishment,ric Roeslers' professionalism,  product knowledge, and highly competitive price convinced me into choosing Kidd Roofing.  The crew was polite, clean, and fast working.  There were a few minor details on the roofing of the upper deck of my porch/patio that needed redone and Eric had his crew repair it to my liking. I am very satisfied with his work and will definitely recommend him and repeat business!  Sincerely, PG,Eric Roesler and his crew installed a new roof on my large, single family home.  They worked in a most efficient manner.  The roofers were courteous and the clean up was done very well.  I highly recommend Kidd Roofing.,Jeremy was professional and called ahead to let me know when he would be arriving. Addressed my concerns and said to call if there were any other problems. Very straightforward fellow which is appreciated.,Eric Roesler with Kidd roofing was an amazing contractor to work with.  I was in the process of selling my  home and moving out of state. I needed to have my roof removed and replaced.  Also needed new gutters removed and installed.Eric dealt with my insurance company and managed the entire roofing project seamlessly. He's probably the best sub-contractor I've ever worked with... professional, reliable, and honest! Thanks for all the help Eric.,Horrible! They don't call back. I have been waiting for two months and today I'm told they have some problems and cant get to it. I even gave them a referral and they never even called them. Sorry! Sorry! Company and representative!
Andrea's Sta-Tex Roofing Co,2738 Hitching Post St, San Antonio, TX 78217, USA,+1 210-532-7323,,https://maps.google.com/?cid=17695889748843841712,,roofing_contractor, point_of_interest, establishment,
Invision Roofing,2819 Woodcliffe St #205, San Antonio, TX 78230, USA,+1 210-838-6062,http://www.invisionroofing.com/,https://maps.google.com/?cid=262068344027151474,4.1,roofing_contractor, point_of_interest, establishment,nitially they sent a crook that used to work for them, John Dietrich. The guy disappeared and I called the main office and they sent Mr. Wallace. He was helpful and got the job done on time. The roof looks good but during installation the crew pushed the lid of the furnace exit shut and fumes were accumulating in the attic. Invision refunded the expense of getting it fix, which is why I am now giving a good review. If you hire them, ensure the project manager gets on the roof and examines the job, the issue could have been prevented by a final inspection. Overall the service was good and the roof looks great and they took care of the only issue I had with the installation. I will call them again if needed, and I will ask for Mr. Wallace again.Thanks for your help Mr. Wallace.,This is exactly what a roofing experience should be like. Prompt service and quick, easy communication.  Great work and better than fair price.,Great job.., everything was fixed correctly and on time, within budget, after hurricane Harvey made a mess here in Corpus Christi. I would recommend this company to all my friends and family.,I would not recommend or refer Invision to anyone I liked or know. Several RED FLAGS were immediately waving when the 13 to 15 year old Invision Roof Representative showed up. The kid looked at the roof for approximately 20-30 seconds, then wanted to know about insurance, I told him I was paying cash, insurance was not involved. He told me he would give me a quote in two hours. I have been eagerly waiting to see a quote for a job by someone who took no measurements or specifications. I was quickly told by a  representative for consumer protection that it is very difficult to maximize price inflating during large natural disaster for Roofing companies such as Invision when they are told it is cash not insurance. These folks are obviously on the prowl looking for windfall opportunities.....becareful roofing companies like Invision are a dime a dozen right now.,Matt at Invision Roofing is wonderful. He is honest and will take care of a whole new roof (if needed) as well as the smaller jobs. He is very prompt at giving a bid and at scheduling and completing each job. I'm a realtor and he is my go-to roofer as he always come through when we need him - with a quality job and a great price. Call him and you won't be disappointed!
The American Roofing Company,1806 W Martin St, San Antonio, TX 78207, USA,+1 210-390-1973,,https://maps.google.com/?cid=7691921312405501563,,roofing_contractor, point_of_interest, establishment,
Norwest Roofing,15603 Babcock Rd, San Antonio, TX 78255, USA,+1 210-697-9835,http://norwestroofing.com/,https://maps.google.com/?cid=8193817450407878231,4.9,roofing_contractor, point_of_interest, establishment, recently had my roof replaced by Norwest Roofing Company. Such a pleasant transaction from start to finish. The customer service provided was phenomenal. They explained in great detail about the process regarding insurance and the roofing company. As a first time homebuyer, it was well appreciated as I am not sure how that works. Jared, who I was working with from NRC, kept me well informed about the process and was very responsive throughout the entire time. The roofing company came out and finished most of it in ONE day. Additionally, the offered to replace some rotting wood I had going on that I had no idea I had! They worked very quick and efficient. Last but not least, the price. I contacted a couple of roofing companies initially-and Norwest Roofing Company was by far the best bid. I absolutely recommend this company to anyone who needs work done. HIGHLY RECOMMEND!,I recently had Norwest Roofing Company replace a standing seam roof at my business. The roof was old and suffered hail damage in the April storms. I was very pleased with the customer service this company provided. From the first phone call to the completion of the job everything went well and as planned. The crew was asked to start on a Friday due to the office being closed.  They were there early and worked through the day to get the old roof removed and all old materials were hauled away at the end of the day. When they started the replacement the following Monday, they were very mindful of the fact that our parking lot would have several cars and people coming and going for their appointments. They were never in the way and made sure that areas to avoid were properly marked with caution tape.  The end of each day everything was picked up and left clean. When the job was completed they even trimmed up some trees in the parking lot at no extra charge. The roof looks amazing and I couldn’t ask for anything better. Thank you Norwest Roofing.,After having a few quotes on roof work needing to be done, Norwest Roofing had the best pricing and their reviews were neck and neck with the other 3 companies I was considering. Jared was great to work with and easy to get ahold of. He kept me up to date on what was happening the day of the repairs. Norwest was able to come out for the repairs within a week.,Needed roof fixed before selling house.  Norwest came out to assess and gave estimate within 24 hours.  Price was competitive and roofers were pleasant, professional, and knowledgeable.  Overall, a very good experience! Would definitely use them again if needed.  Highly recommend!,Update! Jacob, a co-owner, contacted me and just came out to clean everything up. He was kind, responsive, accommodating, and apologetic. He and another gentleman did a very thorough cleaning. Norwest has also revamped how they approach their jobsites and will now leave flyers on neighbors' doors to stay ahead of these kinds of situations.  I think this was just an honest mistake and a fluke. I was very pleased with their response, and my neighbors seem happy with their new roofing. I'm impressed with how they handled this situation and are now being proactive. They very generously offered me an HEB gift card for the inconvenience. In short, I appreciated their sincerity and willingness to make things right. OP: I'm not a customer, but my neighbor is. They had their roof done a few weeks ago, and my yard on that side was left covered in debris, including shingles, paper, pieces of metal, and nails. I had the displeasure of stepping on a nail. Thank god my dogs didn't! No note was left on my door and no attempt was made to contact me regarding a clean-up. What kind of reputable company would do something like this? Disgusting behavior by the roofing crew!
San Antonio Roof Experts,5225 McCullough Ave, San Antonio, TX 78212, USA,+1 210-904-3075,http://www.sanantonioroofexperts.com/,https://maps.google.com/?cid=6962503147632352903,4.8,roofing_contractor, point_of_interest, establishment, called but they only do commercial work now. It's a shame as they looked quite good based on the reviews.,I did a bit of research on this company after I was recommended to them by a friend, and when I decided to call them to come give us an estimate, they were not only polite, but very informative and patient with me. San Antonio Roof Experts was very efficient, their price was the best we'd gotten, and all around their customer service was great! I have zero complaints, only compliments in regards to using their services, and would recommend them to anyone in a heartbeat!,A+ service.  They communicated early/often and bid pricing that was very reasonable vs. their competitors.  Very professional organization that made the process very stress free for me.  Final product looks great as well,When it comes to Roofers in San Antonio I highly recommend using this roofing company due to their large professional staff available to help. They are a roofing company that is there for you when you need them. Highly recommend them!,After the severe storms last week, we were in desperate need of some quick and efficient repairs. San Antonio Roof Experts provided both a wonderful customer service experience as well as a thoroughly professional job. I would definitely recommend them for any of your roofing needs.
