Business Name,Address,Phone,Website,G+ URL,Rating,Categories,Reviews
MH Hernandez Roofing,2754 Culebra Rd, San Antonio, TX 78228, USA,+1 210-970-7837,http://www.guttercleaningsanantonio.com/,https://maps.google.com/?cid=5313764444928338087,5,roofing_contractor, point_of_interest, establishment, have been using Hernandez Roofing for about 5 years now, and every time it is always a pleasure to work with... Reasonable prices, outstanding quality and timely service makes the best value in town...
America's Roofing & Restoration Company, LLC,1327 W Magnolia Ave, San Antonio, TX 78201, USA,+1 210-998-3031,,https://maps.google.com/?cid=1483055430050633486,,roofing_contractor, point_of_interest, establishment,
A-TEX Roofing & Remodeling,16106 University Oak, San Antonio, TX 78249, USA,+1 210-777-7663,http://www.a-texroofing.com/,https://maps.google.com/?cid=764129472739043928,4.5,roofing_contractor, point_of_interest, establishment,First time using A-Tex roofing. Phil came out and gave me and estimate for maintenance. He took pictures and showed me some of the problems. Later I had him come out to do the maintenance. He fixed two potential leak, plus other issues that might have caused problems down the road. They are very professional and did a good job. Again this gentleman was very patient and easy to work with. Plus, he is a big Cowboys fan which is a major plus!,Phil from A-Tex Roofing came out today to give us a quote on a new roof.  We were so happy to hear that our roof looks good and we won't need a new roof for a very long time! It was such a relief!  We so appreciate the honestly and will recommend A-Tex roofing to friends and family.  Thanks again Phil!,Decided to give this company a call for the job I needed done since I always see them around town. Overall it was a great experience! My estimator Jerry was very knowledgeable and anytime I needed something or had to call in, Nicolette always took care of me. The job got done in a timely manner and the customer service was exceptional. Would recommend to any one!,First I'd like to disclose, I rarely write reviews. With that being said, I was very pleased with my experience with both A-TEX and the staff. I've had several home projects over the years and none come close to the level of service provided by Philip Revland and the team over at A-TEX! Helpful and professional!,Philip Revland was the best! He handled everything and made the repair such a fun and exciting job. It was so great to have somebody on your side making sure that everything was covered and taken care of. We highly recommend him and A-TEX!
DISCOUNT ROOFING AND REPAIRS,923 Stonewall St, San Antonio, TX 78211, USA,+1 210-427-2452,http://discountroofing.org/,https://maps.google.com/?cid=1344159283621703461,5,roofing_contractor, point_of_interest, establishment,iscount Roofing. And Rick Ellis and his team did our roof & gutter in September and were great. They were very professional and did an excellent job. Came in early morning and were done by the late afternoon. Would highly recommend Discount  Roofing for any work that needs to be done.David brown
Shield Roofing,19179 Blanco Rd, San Antonio, TX 78258, USA,+1 210-348-3680,http://www.shieldroofingonline.com/,https://maps.google.com/?cid=11293674277106498023,4.7,roofing_contractor, point_of_interest, establishment, have had the pleasure of working  with Shield Roofing twice.  Both times they gave excellent service and did a great job on the roof.  I highly recommend working with them.,An outstanding experience.  We have a complex rolled metal roof, with multiple valleys, dormiers, separated sections, breezeway/garage, all interconnected. No insurance involved. We received 6 estimates.  Shield was about the middle of the pack.  One outfit didn't even inspect, just looked at a Google Earth view and shot us an estimate that was ridiculous.  Mason was our contact person, who performed a very extensive inspection; explained his plan in detail, including possible eventualities including potential for additional costs, such as for subroofing material replacement; and then personally supervised the project with at least daily visits.  He was always readily available for questions, and was so patient with my numerous Type A inquiries.  The crew was remarkable. All were pleasant, very polite, considerate of our needs during the process (about a 3-week construction), and performed excellent cleanup.  These guys worked until dark (this was last summer, so they were there until nearly 9 pm) on several days. We had some rain in the middle of the project - a crew hustled out and covered the roof with an impermeable material.  These guys were climbing around on our roof during a thunderstorm! Excellent attention to detail; we ended up with a much better roof than what we had before.  Highly recommended.,Shield did an excellent job! I have a difficult roof to work with because of an add-on and had a persistent leak as a result, and although it required extra materials and  labor, they took care of it expertly  and for no extra charge. The leak is gone. Mason was very helpful and courteous and was clearly concerned with doing the job right and making sure I was happy with the work. The guys worked very cleanly and efficiently - finishing in one day, left no mess and were also very courteous, conscientious, and friendly. You cannot go wrong choosing these guys. Value, quality, and all the intangibles are there.,Shield did excellent work on a roof that was very difficult to work on.  Additionally, it started to rain however, that did not stop Pablo from completing the job.  Thank you Henry quick and efficient response to my roof repair needs.,Filled out an online request for this company to come look at my roof on Friday. It's now Tuesday and I've received no response. I called the company to see if I can get someone on the phone. Speak to a rep who tells me theyre booked until April, but someone could at least come look at it. I say ok, when can you look at it, then instantly changes mind on that, and says they cant even look at it until April. They came recommended from a friend, but apparently doesn't even feel the need to capture my business. Could've emailed that to me Friday, and I'd already have been looking for someone else. Wish I could put half a star... NO HELP AT ALL!!!
3G Roofing,9263 Huebner Rd, San Antonio, TX 78240, USA,+1 210-373-3358,https://www.3groofingsa.com/,https://maps.google.com/?cid=14119801185526924978,4,roofing_contractor, point_of_interest, establishment,Good place, decent work..
Rhino Tuff Roofing,San Antonio, TX 78223, USA,+1 210-333-4245,http://rhinotuffroofing.com/,https://maps.google.com/?cid=11458002255116196502,,roofing_contractor, point_of_interest, establishment,
Salazar Roofing & Construction,6031 Randolph Blvd, San Antonio, TX 78233, USA,+1 210-650-0705,http://www.salazarroofing.com/,https://maps.google.com/?cid=2218471207821204156,3,roofing_contractor, point_of_interest, establishment,xcellent job!  We needed a new roof and they worked with us on pricing and did a great job and was finished in a day and a half like they promised!  We had an active leak so they put a rush on it and got to it fast!  I appreciate all they did and highly recommend them!,We didn't work with them, but we witnessed them plugging in their tools into our neighbors house, who at the time wasn't home, and it wasn't even the house they were working on! Shame! We went over and unplugged it. That was a very unprofessional move on their part.
Best Choice Roofing and Home Improvement,4241 Centergate St, San Antonio, TX 78217, USA,+1 866-237-8246,http://www.bestchoiceroofing.com/texas/san-antonio/,https://maps.google.com/?cid=9748174180505835412,4,roofing_contractor, point_of_interest, establishment,idn't use their service, they were looking in my neighborhood for damaged roofs to stick their flyers on I am guessing, but I did have a terrible experience with some at this company. To make a long story short:Marco and his helper were sat in the middle of the street in my neighborhood. I was on my way home and decided I would just pass them up instead of waiting on them. Marco punched the gas once I went to go around, and I had to get back behind him. I was a bit close and he decided to brake check me. I hit the brakes and our cars were about a meter apart. I honked my horn at them when Marco threw the truck into reverse and hit me. Marco inspected his truck and then came up to my window asking what my problem was. I had never been in an accident or seen road rage up close and was very intimidated. I started hollering at him to get away from me and that he had just attacked me with his truck. He backed up and started on about how I was crazy, asking if I had "taken my meds" and all of this. He then asked who I thought the cops would believe. I was by myself and he had his helper with him. He went on saying that they wouldn't believe something like that & continued to call me a crazy lady. This happened in September of last year, I was 21, all by myself & really shaken up. I regret not following up with police about what happened.,The sales guys that came to the door were great, then their lead Marco went back on everything i was quoted and promised. Marco changed the cost of the roof 3 times. Ended up having my mothers roof done first because a tree branch fell on it and cracked the roof. Insurance didnt pay out so Jason, one of the other leads said i could make payments.  I would be billed interest free as long as i was actively paying. Then  Marco promised to take $500 off of doing my moms roof which no one honored. The work was contracted out to a different roofing company and was rescheduled 4 times. All the prices quoted went up by a good amount. I had asked that ALL the decking be replaced. The production manager Greg said only 6 sheets needed to be replaced so i spoke to the lead roofer who said all of it needed replacing. It was finally done but no drip edge was put back on. In all this my roof was completely paid out. But now my roof which is 100% paid will not be scheduled until i sign a financial agreement to pay my mothers roof. My roof is being used as leverage but im suppose to trust they will keep their word and do the drip edge after all their lies. DO NOT USE THESE LYING PEOPLE!  You WILL regret it if you do. I was stupid, please dont be stupid too.,Well BCR started out good with Marco from BCR knocking on my door and asking about doing a free estimate on my roof.  He reached out to my insurance company and met up with the adjuster.  During this time he kept in touch with me etc.  There was a stain on my bathroom ceiling caused by the damaged roof and BCR was going to send my insurance a quote, which BCR claimed they had sent it but my insurance never received.  The roof got done, I was not very happy with the nails showing through my deck roof but they could not help that, then the roofers ran out of material so had to come back the next day to finish.  To this day I have not had my bathroom ceiling issue resolved and now that the roof is done, Marco has no need to help me resolve this.  Good talker I guess you could say, when he was getting me to do business with him, but  once the roof was up that was that.  I reached out to BCR and they sent someone out to give me a quote for the ceiling but they just gave me an amount and according to Greg, he doesn't do sales so he can't send a quote to my insurance.  Ridiculous!!,BCR just finished my roof today.  I signed the contract with them in May after the April 12 hail.  At first I felt they were taking too long to get to me to replace my roof. Then I realized that there was a lot of roof damage caused by the hail all over San Antonio and they were very busy. They were very timely in replacing my roof. It took two days only because it rained or they would have finished in one day.  Victoria L. Was very helpful and patient with me.  So was Brenda.  Wayne and Jason were also very  professional and helpful.   Jessey  was very thorough and helpful in making sure that the job went well.  The workers that put the roof were good about picking up all the debris and checking for nails in the yard.  Thanks to all of you.,Best Choice Roofing did a phenomenal job on our roof!. The gentleman that delivered the material were very professional and polite as well as the roofers. My Husband and I are very pleased with our roof. Our neighbors loved the outcome of the roof so they decided to use them as well. I would refer Best Choice Roofing to any of my family and friends.
Your Neighborhoodz LLC | Roofing & Exterior Restoration Contractor San Antonio,10650 Culebra Rd #104, San Antonio, TX 78251, USA,+1 210-262-2678,http://www.yourneighborhoodz.com/,https://maps.google.com/?cid=3302260946163601467,4.6,roofing_contractor, general_contractor, point_of_interest, establishment,Your Neighborhoodz is a fantastic company to work with. Our roof was replaced in one day. The crew was highly professional.  They did the work without putting us out at all. The cleanup was done quickly and completely. Spencer and Matt did a super job in managing everything. You cannot go wrong with Your Neighborhoodz.  Larry and Carol Rowe,When my roof started leaking after the hail storms last year, a friend recommended Your Neighborhoodz to me after using them with excellent results.  They did not disappoint! Spencer (owner) is extremely knowledgeable and gave me several options on how to move forward. He took the time to be there with me when the insurance sent out an adjuster to inspect the roof as well. Having him there made my first time dealing with my homeowners insurance a lot less stressful. He was very good at staying in communication with me on timelines and when the day came to put on the new roof, his crew was top notch. They were very considerate of my landscaping and kept the yard neat through the whole process. On top of that the roof came out fantastic! I wouldn't hesitate to make him my first call again when I need another roof, and you shouldn't either!,If I could just write a review and not rate it with any stars I would. We called this company on a Monday to fix a small leak in our roof. Something I estimate wouldn't take longer than 45 minutes. Since I don't have the equipment or courage to scale steep rooftops I had to defer to the professionals. The leak was scheduled to be fixed later that Monday. A job ran over so they would have to come out the next day around 11am. Tuesday 11am came and went. Finally got a phone call from the roofer that was going to do the job saying the job he was at was running long again but they would definitely be here by the late afternoon. The late afternoon came and went. Got another call around 6pm saying that they were still 45 minutes away and wouldn't be able to do the job since it was dark. He rescheduled for Wednesday morning around 7:30 am.Wednesday morning came and went. This time no phone call. I called the main office and left a message and no call back. It is now Thursday morning and I've still heard nothing from the roofer or his office. I'm not saying that you will have the same issues but be prepared to wait. Horrible business practices. Hope the next person has better luck.,My wife and I are writing to inform you of the excellent service that Your Neighborhoodz roofing and construction rendered at our home last week.  In addition to being very personable,  they were very thorough,  very professional , and very competent. They seemed very knowledgable in their profession , and showed genuine concern regarding the damages to our home . When they left, they assured us that if we had any further questions or concerns,  they would be available and for us to feel free to contact them anytime.  It was refreshing to see someone so dedicated to performing the task  at hand, while at the same time, reassuring the homeowners !  We were so pleased with Your Neighborhoodz  job performance and their integrity  that  we wanted to recognize " a job well-done! "  PLEASE convey our thanks.  Sincerely,  John and Krystle,I have used Your Neighborhoodz several times. They are competitive in their pricing and dedicated to making sure the job is done to your satisfaction. They are competent and hard-working. Easy management to work with. A reliable choice with high-quality work. I recommend them without reservation!
E.E.R.C. Contracting Services,7038 Eckhert Rd, San Antonio, TX 78238, USA,+1 210-682-2804,http://www.eerccontracting.com/,https://maps.google.com/?cid=8086445937502940413,,roofing_contractor, general_contractor, point_of_interest, establishment,
Bentley Sheet Metal & Roofing,5482 Enrique M. Barrera Pkwy, San Antonio, TX 78227, USA,+1 210-434-4184,,https://maps.google.com/?cid=5366039690499093201,4,roofing_contractor, point_of_interest, establishment,5 stars for todd
RepairMyRoof4Less.com,19141 Stone Oak Pkwy #104, San Antonio, TX 78258, USA,+1 830-488-7707,http://repairmyroof4less.com/,https://maps.google.com/?cid=9775919704892681639,4.8,roofing_contractor, general_contractor, point_of_interest, establishment,Aaran did a phenomenal job repairing my roof recently. He was quick to reply to my inquiry - came out and gave me a very reasonable estimate and did the repair the same day.  I would recommend this roofing company without hesitation.  Thanks Aaran!,ROOF REPAIRS/ROOF REPLACEMENT HIGH RECOMMENDATIONArran Greenleaf is the owner of RepairMyRoof4Less.com….(830) 488-7707….so we started out with completion of repairs to our roof.  While other contractors were telling us we needed to replace our roof here comes Arran Greenleaf.  Arran provided the most intricate details on what was actually needed and it matched the insurance adjustor’s decision that our house was not ready for a roof replacement.  We didn’t tell any of the contractors what the adjustor had told us to see if they had integrity!  We only had one that had integrity – Arran Greenleaf with 25 years of experience.It was then time to replace our roof and don’t let Arran’s company name mislead you as he does roof replacements and I am providing pictures of the beautiful roof he put on our home.  We were able to see pictures with his 3D Roof Models as some of us can’t crawl on roofs.  Arran understands roofing more than any contractor we have done business with and we just remodeled our entire home so can compare his skillsets and passion to other contractors.  He is not out to make a quick buck as he follows up with your family to ensure you are more than satisfied.  Arran does not work a 9 to 5 schedule and will support your schedule needs when you need to meet with him.The actual attention to detail is exemplary!  Arran has a professional flashing work team and the front of our house with the base and counter flashing around the entryway is the best it has ever looked and the quality workmanship stands out!  It is strange to say this; our new roof makes me feel secure as I know Arran cares about my family.  The rain and wind we have had recently, I am inside and have a peace of mind that I have no worries about leaks, finding shingles on the ground after a storm, or having the flashing work leaking into our ceiling and walls.The fireplace chimney base flashing was replaced and we hired a carpenter recommended by Arran as we wanted the rotted wood at the top replaced with plank.  I only have pictures to see it but have a sound mind we won’t have any leaks and our roof is sound for another 20 years or longer.Also, Arran has hydraulic dumpsters on wheels that are used with the work site cleaned up every day before the contractors leave.  We have all seen the flatbed trailers that are used and neighbors see all the debris from start to finish.  I actually caught Arran stopping by one evening outside to make sure quality standards were being met.My family is a firm believer that when you have a customer experience that should be shared with others you take the time to do it!  The Thees Family highly recommends Arran as he is a passionate soul that wants to help you figure out how to repair your roof, meet with adjustors, and when the time comes have a high standard quality roof.  We typically don’t think much about our roofs until we have leaks or see shingles on the ground.We love our new roof and here are the pictures to prove the quality workmanship stands above the rest!Thanks Arran and the RepairMyRoof4Less Team!The Thees Family,Arran was very knowledgeable and friendly.  Gave me a call less than a day after filling out online form.  He was able to find the cause of my leak, when another roofer couldn't, that roofer  blamed it on my HVAC system.  HVAC tech came out and said system was fine.  Got roof repaired less than a week after submitting online form.  There was no leaking from this past weekends storms.  Thank You Arran.,I emailed RepairMyRoof4Less to get a quote to repair a leaking box vent on my roof that was causing my ceiling to leak. Not only was Arran the first person to call me back out of the 3 companies I reached out to, he also was the first to come inspect the home. Within a total of a few days, he had taken pictures of my roof, walked me through my options and performed the work. I ended up replacing all the vents and installing a ridge vent. Arran was very nice to deal with, very knowledgable and fair pricing. Will not hesitate to call him for any future repairs. Thanks Arran!,It took me a while and several quotes to find the roof repair company that I was comfortable going with. As a first time home owner I was very hesitate and cautious picking someone to trust to fix what I have worked so hard for. Then I met Aaron. He wasnt like all of the other people who came out to give me a quote. He explained everything to me in detail and made me feel comfortable with the whole process. Theresa was also very sweet and even returned my calls after hours due to my work schedule. I would highly recommend Repair my roof for less. This company delivers not only quality in their work but they also truly value your business.
Jimmy's Roofing,9931 Roosevelt Ave, San Antonio, TX 78214, USA,+1 210-632-0759,http://www.jimmysroofingllc.com/,https://maps.google.com/?cid=3212126407801386236,4.8,roofing_contractor, point_of_interest, establishment,We were so impressed with Jimmy's Roofing.  Its rare to find a company who is honest, dependable and take pride in their work.  The crew was punctual, courteous, professional and tidy.  Our roof is absolutely beautiful and the quality of your work is tremendous.  Thank you Jimmy's Roofing for all you did for us.  We highly recommend your company.,Jimmy's Roofing did a great job and were competitively priced . Marina was great to work with.I have received  compliments from many people walking or driving by my house. Jimmy's roofing crew were fast and efficient. I really like that they are a family business. I would strongly recommend Jimmy's Roofing to anyone.Eric B. Braun Station East,Workers came on time. They worked hard to repair a roof that was close to caving in from older roofs being stacked. Friendly crew. Jimmy came personally to assist with the job. Yard was left clean. Highly recommend using Jimmys for your roof repair.
