Business Name,Address,Phone,Website,G+ URL,Rating,Categories,Reviews
Great Built Roofing - San Antonio Roofer | Roof Replacements | Installations & Commercial Roofing,8000 W Interstate 10 #600, San Antonio, TX 78230, United States,+1 210-663-0464,https://www.sanantonioroofingrepair.com/,https://maps.google.com/?cid=4100820923059901893,4.9,roofing_contractor, point_of_interest, establishment,Awesome experience! First time having to have a roof replaced and this first class organization and its people made it seamless. Brandon and Will were both easy to get a hold of and were professional, upfront, and over all a pleasure to work with. Their roofing crew was efficient and thorough too. If you're in the San Antonio, Houston, or Coastal Bend area and need roofing work, look no further. Great Built is the company you want to use!,Professionals from the very detailed estimate through to the job completion. The work crew arrived as scheduled, removed the old shingles and installed the new roof, all in one day. They also did a good job of cleaning up. I am very pleased with the work.,Great Built Roofing delivered on their promises, and then some.  They provided exceptional service, quality work, and not only met, but exceeded, our expectations.  We highly recommend giving them a call to assess your roofing needs.,Best roofer I have ever meet. Replaced my roof in 2017. I have recommended him to all my friend and family.,This is a "Great" company with values, and attention to doing a job the right way.  Back when we had the hail storm I waited to get estimates.  Most places I called wanted to know if this was an insurance claim right off the bat.  If you told them you wanted an impartial estimate they would hang up.  Not Great Built.  They never asked.    Gary came out and gave me an estimate, and the owner, Neely, came out after the job was done to make sure everything was good to go.   A week or so later Gary came by to check on things.  I found a nail that wasn't all the way  down.  He promptly fixed it.      If that review isn't good enough.....     I was so impressed by this company when my mother-in-law said insurance would no longer insure her roof we called Great Built.   The estimator spent about 2 hours on the estimate, but when asked if the roof needed replacement he told us it didn't.    It would have been easy for him to say it did, and charge us $9K.  I asked him why he didn't.....  His answer was awesome.   "This company doesn't operate that way, and if they did I wouldn't work for them".
American Roofing & Metal Co. Inc.,801 Wyoming St, San Antonio, TX 78203, USA,+1 210-224-5463,http://www.amerroofing.com/,https://maps.google.com/?cid=17291819275556279226,2.3,roofing_contractor, point_of_interest, establishment,Very unprofessional they got paid for a simple job and it leaked and they were unwilling to come back and fix it right you know who your are mark sansing. Don't use this company go somewhere else
San Antonio Roofing Master,700 N St Mary's St, San Antonio, TX 78205, USA,+1 210-239-9079,http://www.sanantonioroofingmaster.com/,https://maps.google.com/?cid=10709465719498489592,5,roofing_contractor, point_of_interest, establishment,y experience with San Antonio Roofing Master has been nothing but positive from the very beginning. Based on my interactions with every member of their crew, I can recommend them without reservation. Both my wife and myself love Roofing Master of San Antonio.
Integrity Roofing & Siding,4807 West Ave, San Antonio, TX 78213, USA,+1 210-340-7663,https://www.integritysa.com/,https://maps.google.com/?cid=17454702239555757342,4.5,roofing_contractor, general_contractor, point_of_interest, establishment, could go on and on and on about how wonderful Integrity Roofing & Siding is, but....if you need a new roof, look no further!!  They are the best!!  Their customer service and follow-up is top notch!!  Abel is fantastic!!  He will take his time in explaining the product to ensure that you get the perfect roof!  We upgraded our shingles and added additional vents.  Michelle and Aaron in the billing department are amazing.  They worked with our insurance company and invoiced them for the final payment, leaving us out of it completely.  Finally, the crew!!!  From start to finish, they were efficient and did an AMAZING job on our roof.  Additionally, they were meticulous about ensuring our front and back yard were SPOTLESS!!  We might not have the nicest house in our neighborhood, but we DEFINITELY have the nicest roof!!  Thank you Integrity Roofing & Siding!!,Had my roof replaced after last year's hail storm. I chose integrity because they had done the roof to an addition on my home and it looked like it was done well. It took them about 6 months before they could actually replace the roof. This wasn't a problem because by old one was still holding up. The staff have been polite and professional however, very difficult to get a hold of. Now my issue. First storm of the year, my roof leaks. I had wet drywall and parts of my ceiling falling apart. I had to leave messages and call over and over for most of the day before anyone answered at the office. A tech came out the next day,put some caulking around the skylight that was leaking ( something that they forgot to do when they put the new roof on) gave me his number in case it leaks again and said that they would recheck it in a year. No offer to fix the damage caused by their negligence. A few weeks later, my roof is leaking again. Same spot as last time, with even more damage. I've now called the tech and office, left a message but it's a weekend. I have no ladder to get on my roof and cover the leak and there's more rain on the way. Thank you integrity roofing. My children and I are now just preying that the roof will hold through these storms.,Every worker displayed talent, and untiring effort in a hot and high work environment. Roofing is artisan beauty and my roof is a completed project reflecting excellence!,Spoke with an agent yesterday, and after several questions from the representative had an appointment scheduled. Just received a call from the estimator stating that they do not do residential properties in my area. This being after I made it very clear the first go around where the property was, and also letting them know it was residential. A few minutes later got a call back saying that the person who originally scheduled me was in training. Thanks for the apology, but it still doesn't get my roof fixed. On the plus side, if they can't even train someone answering their phones about what services they provide or even which areas they service, maybe it's for the best.,Due to the recent hailstorm in San Antonio, we had to have our roof replaced.  I contacted several roofing companies, and many companies were "fly by night operations." After careful review, we selected Integrity Roofing to complete the job.  The sales rep, Abel, went over the roof replacement process.  He told us what we should expect and who would be contacting us throughout the process.  True to their word, we received calls along the way explaining what the next steps would be to complete the job.  I always knew what to expect...The roof looks beautiful, and they completed it in a timely manner.  Thank you, Integrity Roofing, for a job well done!
Rio Blanco Roofing & Restoration,600 Sandau Rd #800, San Antonio, TX 78216, USA,+1 210-253-9665,http://rioblancoroofing.com/,https://maps.google.com/?cid=7251330554232497698,5,roofing_contractor, general_contractor, point_of_interest, establishment, wanted to take a moment to express my gratitude towards your company. In the beginning of this process I researched for roofing companies which led me to Rio Blanco Roofing & Restoration. From the start Jim’s customer service was outstanding and he was very helpful throughout the whole process of getting my roof replaced. I couldn’t be happier with the quality and appearance of my new roof. And there are still companies out there worth taking a moment out of your day to praise the hard work and dedication to their product and expertise.   Proud home owner,Joe G.,Jim and his crew did a wonderful job on my roof. They were on time and did quality work. The price was great and they left my house and yard clean. They went way above what they were supposed to do and did an exalant job. I would recommend them to all my family and friends. You get 5 stars from this family. Thank you so much for a great job done on time.,Rio Blanco is the best!!!  I had a leak and they came the same day.  Jim was really knowledgeable about my insurance and even gave me two different estimates!  One for shingles, and one for a mental roof..  they got everything done in a timely manner and cleaned everything up around my house everyday!!!  Thank you Rio Blanco!!,Great company! Jim was great to work with and the roofing crew did an excellent job!  Highly recommend!,I previously left a review where I was unhappy with the communication from Rio Blanco. That was due, unfortunately, to an employee who is no longer with the company and not the fault of Jim and his team. Since then, I have worked with Jim and his team and I am extremely happy with their work. They came out and repaired some flashing and siding issues around my chimney, and I am very satisfied with the communication and repairs. Jim worked hard to make everything right and I could not ask for more. I will highly recommend Rio Blanco to anyone who needs roofing work done.
Alexander's Roofing,350 W Broadview Dr, San Antonio, TX 78228, USA,+1 210-436-1135,http://www.alexandersroofing.com/,https://maps.google.com/?cid=13506050477355537614,4,roofing_contractor, point_of_interest, establishment,Alexander's was recommended to me by a co worker who had two roofs replaced by this company.  Alexander's is a great roofing company. The staff is very professional.   Someone was out to my house quickly to inspect my roof and give me a quote.  Once the contract was signed the materials were ordered and the roof was replaced.  The workers were professional and cleaned up all materials after the work was finished.  The owner came back two days  later to collect payment and he even pointed out differences between my roof and some of my neighbors who recently had their roofs replaced by other companies.   I am very pleased with Alexander's roofing and would highly recommend if you need a roof replacement.,Yes, this man arrived at my residence and let me tell you he was so nice and very intelligent and blunt. My roof was needing a change he tells me the problems that my roof needed,the workers were so professional and they completed the job with no problem. Thanks Alexander😃,Very profesional and cutious workers and staff. They started and completed my roof on schedule and did an outstanding job.  They completed my roof without any money down until my insurance submitted payment weeks later. During that time I was never bothered.  I highly recommend this company.,Two missed appointments. No callback.  Sad.,This roofing company has completed  several roofing projects for me through  the years they are an honest, company and they stand behind their work. I would highly recommend them to anyone
Alamo Roofing & Metal Co,1319 March Ave, San Antonio, TX 78214, USA,+1 210-333-1200,http://www.alamoroofingandmetal.com/,https://maps.google.com/?cid=15267543632793422373,,roofing_contractor, point_of_interest, establishment,
DISCOUNT ROOFING COMPANY,2418 Jackson Keller Rd, San Antonio, TX 78230, USA,+1 210-427-2452,http://discountroofing.org/,https://maps.google.com/?cid=8535467173784523116,5,roofing_contractor, point_of_interest, establishment,iscount Roofing just got done with my roofevery looks great...we had alot of rain and no leaks..And saved me $1,200.00 cause they discounted my Deductible.Thank youb
Durizon Roofing & Construction LLC,9200 Broadway St, San Antonio, TX 78217, USA,+1 210-281-4092,,https://maps.google.com/?cid=1138641751607839418,1.2,roofing_contractor, point_of_interest, establishment,Scumbag Richard Stevens finally got justice served - got 99 years for Theft of Elderly from the State of Texas plus and other 99 years from the Federal Govt for mortgage and wire fraud. This guy is going to die of old age in prison, he will never breathe free air again- chickens finally came home to roost!!  Mark was already on lifetime parole, he got sentenced to prison for the rest of his natural life, zero eligibility for any parole whatsoever...,DO NOT SIGN A CONTRACT WITH DANIEL GARCIA this guy doesn't work for this company anymore. I swear to you San Antonio it'll be like giving your soul to the devil. I had no idea he didn't work for this company anymore and wrote them a check and have been waiting to hear back for over a month. When he finally returns my phone call he threatens me and calls me "impatient" because I can't wait. Waiting to hear back from Durizon to see what they will do about this mess! But I was told that Durizon is looking for all of his clients and will be giving it to someone else. San Antonio BEWARE!!,Do not do business with Durizon Roofing & Construction Company.  Do not give this company a penny.  They are thieves and will keep your money and give you false promises of starting the work but they never even return your phone call.  Don't get scammed.  This company is now under criminal review.,All the 5 star comments here are obviously fakes produced by Durizon. A good friend of mine gave Durizon a $12,000 down payment check for his roof to get redone with the top of line asphalt shingles from Owens Corning. Durizon cashed that check 10 months ago and has still not done the roof. Last month or so they delivered shingles, but they were the cheapest low end "dimensional" that owens corning sells. There's no other way to describe that than an overt attempt to rob my friend. My friend caught it and they took the materials back, claiming the others would have to be ordered and would be 2 weeks. They've been saying "two weeks" about everything since October of 2015 when he signed the contract. I have no proof that they are frauds, but they are definitely fools. Don't go with any "roofing company" who's main goal seems to be to get a look at your insurance "paperwork". Demand  that they give you an estimate on your roof. If they look dumbfounded or irritated, tell them to GTFO. Trust me, they aren't "roofers",DO not sign with these guys Mark Rodriguez and Richard steven.They got my 5542.67 down payment and never look back.Please call Officer Ronald Davis at 207-8326 if they took your money
The Central Roof Company,22211 I-10 W Access Rd Suite 1206, San Antonio, TX 78257, USA,+1 210-714-4591,http://www.thecentralroofco.com/,https://maps.google.com/?cid=15954503428418922069,,roofing_contractor, point_of_interest, establishment,
Embrey Roofing Co,3706 Roosevelt Ave, San Antonio, TX 78214, USA,+1 210-924-8371,,https://maps.google.com/?cid=1285609149028511425,4.4,roofing_contractor, point_of_interest, establishment,xcellent roofing work! I would use them again.,I have my Chevrolet beat 2010 and I had a problem with door lock the door wouldn’t lock. I called A1 Locksmith Service they came on time and fixed it in 15 minsA1 Locksmith Service provides the best services at reasonable prices.,I was locked out of the house at 6 a.m yesterday and I was trying various locksmiths who weren't answering their phone or wouldn't be in the office till 9 a.m , called city locksmith got a pleasant answer on the first ring and a visit within 10 minutes to my house.A1 Locksmith Services, Highly recommended. ,I needed a duplicate key but I have consulted with 2 or more locksmith but I found them very expensive then I have consulted with A1 locksmith and they duplicated a key for me at cheap prices with quality services.Quick and efficient locksmith services……,I have shifted to the new place and the lock of new place was very old and it was very difficult to work with it , I have called the city locksmith he came within 15 minutes and re-keyed it within couple of minutes.Such a great services of A1 Locksmith Service..........
Bondoc Roofing,900 Isom Rd Ste. 222, San Antonio, TX 78216, USA,+1 210-896-3209,http://www.bondocroofing.com/,https://maps.google.com/?cid=12445536418542714872,4.8,roofing_contractor, point_of_interest, establishment, strongly recommend Bondoc Roofing. You meet and describe your problem with the owner James Bondoc. James is very knowledgeable and can offer the most competitive solution using top quality materials and craftsmen. His installers were a desirable team of skilled metal technicians who met my high quality standards. James also monitors the entire project and conducts a final walk through inspection with you for your approval.,Recommended - good, reliable roofing company. We had some shingles missing from a storm and a friend recommended them. They did the repairs for a reasonable price and we would definitely use them again.,After a hail storm and major wind damage, our roof was in such disarray and we were in distress. My husband and I delayed our repairs because we simply could not get comfortable with the approach other roofing companies had for overseeing a roofreplacement from start to finish. With James (owner of Bondoc Roofing), we were just so impressed with his professionalism, communication throughout, his crew's timeliness and definitely Bondoc's quality of work. The follow through every single step of theprocess to include closing the loop with us post-replacement to ensure we were fully satisfied did not go unnoticed. Additionally, one of the crew called after the job to come by to do a final, final inspection to ensure everything was perfectly tidy - there was not a single remnant of construction and they were mindful to cover things like our pond during the tear down and replacement. Bondoc Roofing also went the extra mile and included some incidental gutter work and repairs at no charge. It is very apparent that quality and customer satisfaction is their #1 priority. We could not be more pleased with the crew and office staff at Bondoc. We'd definitely give them 10 stars if we could!,We live out-of-state and had to have roof repair done on our rental property in San Antonio because of a leak that developed during some bad weather. The Bondoc Roofing representatives we spoke with (Eliza, James, & Bryant) were polite/friendly, answered our questions, patiently explained the problem and their recommended solution, and emailed us photos before and after the repair. We did have to wait some time to get on the repair schedule because the company was very busy, but on one of our follow-up calls to try to get on the schedule, we found-out they had already performed the repair, and they quickly apologized for not contacting us and keeping us informed. Overall, we have had a positive experience with Bondoc Roofing.,Bondoc Roofing is top-notch!  My roof recently sustained some damage from a storm earlier this spring and after several inquiries, I chose Bondoc Roofing after a solid recommendation.  They are experts in their field and without question did a tremendous job.  I was also faced with selling my home after the storm and Bondoc Roofing went out of their way to meet my deadlines and personal needs to make my sell successful.  Most importantly, Bondoc Roofing is excellent with customer service.  Alexis is the real deal and all businesses should model her style in providing superior courtesy and respect to clients.  I highly recommend Bondoc Roofing!
CJ's Roofing,114 N Ellison Dr #110, San Antonio, TX 78251, USA,+1 210-201-3687,http://www.cjsroofingllc.com/,https://maps.google.com/?cid=9819010744812915779,4.5,roofing_contractor, point_of_interest, establishment,CJ's roofing came out and gave me an estimate within a day. They were very affordable. Carlos and Ruby were friendly and professional. They answered all my questions. The next week they started my roof. The roofers were on schedule every morning. It took two days to complete. I appreciate that they cleaned up well afterwards. I would recommend them.,I am very pleased w the work that CJ’s men did. I got a whole new roof for my apartment and Carlos adjusted the price when he saw the decking didn’t need replacing. Most companies would not have done that.This is the second time that I have used CJ’s. They corrected a mistake that another company had made. This was another house.Again I am VERY pleased!,The work was started and finished very quickly. The roof looks great and the high end materials will add value to the house. Thank you Carlos and crew!,Terrible roofers. We had a leak on our new roof within a month after they "repaired" it because they forgot to seal around external fixtures on the roof. They also outsourced partial work for the project to a contractor whose quality of work was very poor and still does not appear completed (a separate roofer solicited our house about 1 year after the initial repair and told us our roof looked damaged and asked us if we wanted him to fix it).Now the company is sending us veiled threats regarding possible legal action to cover their poor performance. Avoid this company, there are plenty of better ones to choose from.,We contracted with CJ's Roofing for repairs in Rockport after Hurricane Harvey.  We asked CJ's to bid because of the high rating it has on Angie's List based on 200 reviews.  CJ's removed the damaged roof and installed a new one in less than three days and also replaced damaged siding and repaired damaged porches, all at a competitive price.  The roof was a challenge because it is very steep.  The crew worked well together, were very professional and polite.  Each day they cleaned the work site of debris.  We were very pleased with the work that CJ's did especially considering the fact that it was done to repair our storm damaged house in such a timely manner.
