Business Name,Address,Phone,Website,G+ URL,Rating,Categories,Reviews
Beldon Roofing Company,5039 West Ave, San Antonio, TX 78213, USA,+1 210-341-3100,http://www.beldon.com/,https://maps.google.com/?cid=17341715109159731967,4.2,roofing_contractor, point_of_interest, establishment,Although we are very pleased with the workmanship and quality of our new gutters we can only give 3 stars.  We would love to give 5+ stars to Cesar, Raul, and Marco who installed them.  They were professional, knowledgeable, friendly, and extremely courteous.  Cesar and his crew did a great job with the installation with attention to detail and function. The low rating is due to the poor communication we received from the corporate and San Antonio offices.  Calls not returned and zero resolution with issues thru their offices.,I had to wait several months to get a replacement roof due to hail damage from  Beldon because they were so busy.  But, it was worth it in spades.  They were top notch in every respect.  They did a great job of negotiating  with my insurance company to get the top quality shingles that  I had replaced.  The  project manager was  seriously involved and the  expert team  did a great job of installation and clean up .  The follow  up inspection was real and  they actually did a couple of extra  jobs  not  in the contract.  The way this company operates  is very impressive and  I strongly recommend them if you value your house.,I want to give the highest possible review to my Beldon Project Consultant, Jane Gimbel. She helped me select the exact gutters that would be best for me; she adjusted the water flow to make it simpler and more reliable; and she helped me resolve any problems. I would not hesitate to work with her again.,Beldon Roofing was amazing to work with. The office staff was so nice and kept me informed during the whole process. Thanks to the whole team, love my new roof!,I worked with TEAM BELDON. I have not found a more sincere company to work for across of sectors of my career. The leadership is above reproach when it comes to truly striving for customer service. The care they show towards their staff in my opinion is second to none. They might make some mistakes but the will to correct them earns my respect.
Cloud Roofing Company,434 Breesport St, San Antonio, TX 78216, USA,+1 210-366-9484,http://www.cloudroofing.com/,https://maps.google.com/?cid=11246407719875729328,2.9,roofing_contractor, point_of_interest, establishment, recently had a roof repair done prior to hurricane Harvey by this company. I had a leak around the chimney which had leaked inside on the ceiling.There representative inspected the area to be repaired and gave me an estimate of $850.00, and an estimated schedule for the repair, which as approximately in two weeks. With the hurricane approaching I was concerned that I would incur more damage inside so I call the representative and he came out and put a tarp around the suspect leaking area. This temporary solution held up during the storm and I did not have any more leaking inside. About two weeks later a roofing repair crew came out to do the repair which took about an hour. A week later I received an invoice for $850.00, which was the same as the estimate. I spoke to the representative toexpress my concern that the cost of the repair was very high for the materials and the the time spent to do the job.The representative offered to reduce the cost buy $100.00 but I feel $750.00 is still very expensive for the repair. I asked for an invoice refelecting the adjustment and a detailed list of the repair. Waiting to see if this happens.,Terrible company. The shingles they used for the roof repair they did for me did not even match my roof-they are a totally different color! When I called to ask for someone to come by and look at it, they said they were too busy for at least a month, and nobody ever showed up or called. Today my roof is leaking again, and sagging where they did the (very over priced) repair. DO NOT DO BUSINESS WITH THIS COMPANY.,Had issues with the quality of work done by the Cloud Roofing crew hired to install roof.  The owner, Ken Cloud, did contact me and visited my home but all he did was make excuses and yell at me.  He said that customer satisfaction is not his responsibility.  You would be wise to go with another company as his integrity and basic customer service skills are lacking.  Due to my customer experience, one star is one too many.,My roofing experience w/ Cloud Roofing was the WORST I've ever encountered with any roofing company I've have ever used in the past. The final product of my roof replacement left for a WAVY ROOF throughout. They never spoke to me about re-decking options and/or replacing rotten wood. When I called to remedy the situation...Cloud roofing (Aaron & Mr. Ken Cloud) gave me a run around that lasted 5 months. In the end, they wouldn't do anything to repair or redo the job. They blamed the quality of the poor job on simply being bombarded due to the storm, and they simply couldn't keep up with the influx of jobs. In addition, the owner went on to say that, "well, all houses in Leon Valley have wavy roofs...it's not a big deal". My experience was one of a RUSHED JOB with POOR workmanship, broken communication, lack of customer options, neglected upfront quality control, and very low standards in the overall job that they provided. I would definitely NEVER DO BUSINESS with Cloud Roofing again, and I encourage you not to unless you want to be taken advantage of by being given a SLOP roof job. Spare yourself the agony! This company should be ashamed of themselves.,This is for the man driving in the brown colored Escalade. Maybe next time you won't be cutting people off while trying to hurry up and switch lanes to get off the high way. P.S. you may not want to be advertising your business while driving like an idiot. Jerk.
Discount Roofing Company,5612 Grissom Rd, San Antonio, TX 78238, USA,+1 210-440-7734,http://discountroofing.org/,https://maps.google.com/?cid=16746283327645847095,4.1,roofing_contractor, point_of_interest, establishment,his is the place to go. 25 year roof $1,500 less than everyone else and did my patio too. I would highly recommend this to anyone. thanks,Joel and the Discount roofing staff are the best!  Extremely pleased with the quality and timely work performed.  The roofers we  professionals and no nonsense attitude when getting the job done. High quality materials and I would highly recommend this company.,First of all great job Discount Roofing .This was my first time having to deal with Replacing a roof or an Insurance claim but Rick said not to worry cause he had done it thousands of times. He explained the whole process to me and how his company would discount my  deductible which is 1% and it was almost $2000.well i still had to pay some of my deductible but i will say that Rick discounted more than half and i was very very happy with that. .the job was great and every thing went exactly the way he explained it to me...Im glad its over it was like going to the Dentist i just wanted it to be over with..But unlike the Dentist my roofing job was painless ..so if anyone is going to have there roof Replace i would very highly recommend you call Discount Roofing and. Rick EllisThanks Discount Roofing.                               Sam M..,I e-mailed into the company and attached an inspection report that needed some roof repair. I followed up with a phone call later in the day. After a few hours I get a call from a lady in the office tht tells me the boss will give me a call. NO call. The next day I call again and leave a message. Hours later I get a call and the same lady tells me I will get a call. I ask her when? She repeats herself and says he will call. NO call. This was a time sensitive situation as we had to get an answer for the buyer wanting to buy the house. There voice message always says they will call back in 10 minutes. That's a lie!,Discount Roofing just finished my roof and it's beautiful. They saved me $890.00 off my deductible to. The job just took 1 day and the clean up was great I couldn't find any roofing on my grass or plants..And Rick did some extra work and didn't charge me for it so thanks again Rick.. I will highly recommend you Company to my friends and family. Great Job Discount Roofing company Sharlene Sullivan
Roland's Roofing Co.,6735 Low Bid Ln, San Antonio, TX 78250, USA,+1 210-543-7663,http://www.rolandsroofing.com/,https://maps.google.com/?cid=9447124460866177920,4.3,roofing_contractor, point_of_interest, establishment,xcellent work and we love our new roof! They were courteous punctual and professional, and we look forward to having them do more work for us in the future.,Daniel and the rest of the staff were very courteous and professional.  They did a great job on our roof and I would definitely recommend them to friends and family.,We called Roland's Roofing to inspect and seal our tile roof.  Bryan, one of the managers, was awesome! Very helpful and attentive; he surveyed every area to make sure nothing was missed! And Poncho, the roofer, was also great. He did an outstanding job sealing the tiles and covering some holes created over time. He even found 2 or 3 problem areas we weren't aware of and fixed them. And then he explained everything in detail, answering all my questions. I highly recommend this company.  We greatly appreciate their thoroughness and professionalism.,They fix up our office at Storage Mart roof quickly and efficiently! Great service, fast work, and splendid customer service.,Great company, professional staff! They did great job replacing my roof, i would recommend them to my family and friends. Thank you!
Tony's Roofing Services,5407 Bandera Rd Suite 111, San Antonio, TX 78238, USA,+1 210-632-1003,http://www.bestrooferstx.com/,https://maps.google.com/?cid=17103661938432677007,4.8,roofing_contractor, point_of_interest, establishment,Just got roof done, work was done great. Very pleased with the outcome. Gave 4 out of 5 cause communication could be better. The salesman that we worked with even did a good metal sweep when he came for final inspection. Overall I am happy with the company.,Excellent job on my roof. Efficient and respectful!,Excellent company. On time and very professional.,Tony's crew arrived on time and completed the job in half the time of other roofingcompanies.  Being a residential property manager and Real Estate Brokers for over 34 years this is the finest companies I have had the pleasure of doing business with.I would high recommend Tony's Roofing services.One note:  One roof had a leak three years after a re-roof by this company.  After one phone call the repair was completed the very next day at no costs to my client.Thanks for a job well done.John McFaddenJohn McFadden Real Estate  
Tony's Roofing Services,7447 Brandyridge, San Antonio, TX 78250, USA,+1 210-632-1003,http://www.bestrooferstx.com/,https://maps.google.com/?cid=13123210151236574328,2.8,roofing_contractor, point_of_interest, establishment, had work done by Tony's Roofing Services 5 years ago and just referred my family by the coast. The did an amazing job for me and never had any issues. Professional, awesome job! Defiantly recommended to my family and friends.,They do not stand behind what they do.  10 year warranty that is a joke.  Big mistake picking them to replace my roof.  Do yourself a favor and never use Tony's Roofing.,They took my insurance check back in June.. An over $6000 check.. It's almost 6 months now since the original estimate, and 4 months since they took the check and still we have no roof on.. Seems I was scammed I am contacting my insurance to get a new check and to have Tony's held accountable for taking the money without doing any work,He gave a good estimate, but did not show up to actually do the work.  We had a small job, and Tony wanted to make it a bigger job, and quoted what seemed like a low price for what he wanted to do.  When I hesitated, he quoted an excellent price for the small job we really needed done.  After talking it over with my wife, I got back to him the next day and told him we'd go small, but that he could charge extra for his time when picking up the materials he'd need.  He agreed and told us he'd most likely be over later that day.  Otherwise he would be over the next day.  Well, the long and short of it is he did not show up either day, did not call, and did not return our calls.  Good prices, nothing done - not a good deal.,Tony's roofing was fast, honest, and reliable. Did the job right and in one day. I would recommend him to anyone.Oh yeah, love the upgrades, and house is cooler.
Cram Roofing Co,5171 Casa Bella, San Antonio, TX 78249, USA,+1 210-694-7815,http://www.cramroofing.com/,https://maps.google.com/?cid=16783086582585913234,3.8,roofing_contractor, point_of_interest, establishment,No idea about the service but their technician drive like complete jerks in their company trucks. I'm sure if they ran over a small child they would just laugh about it and flip you the bird. Don't use these people. ,Dude stop hating....
Decker Roofing Co,8327 Shooting Quail, San Antonio, TX 78250, USA,+1 210-825-6125,http://www.deckerroofing.com/,https://maps.google.com/?cid=17069419709448297906,5,roofing_contractor, point_of_interest, establishment,hey've earned my business in the future.  My next door neighbors had their roof redone by Decker Roofing.  I was extremely impressed with the company's professionalism and respect for property owners.  They began their work at a reasonable 7 am, not making any loud noises until 8 or 9am.  While pulling off the old roof, some of the material fell into my yard, no fault of Decker's and they asked (respectfully and in English) before entering my property and cleaned very thoroughly.  After they we're done, I noticed a small pile of nails left on my garage steps.  Initially I was pissed, how could they have missed so many?!  I was wrong, they had neatly piled up nails from the grass I had dropped 6 years ago when replacing the fence, carefully sorting all their roofing nails out.  The yard had already been magnetically swept twice!  I can't comment on pricing but their work looks good and they are as professional and respectful as I've seen in any contracting company.
Santex Roofing - San Antonio Roofing Company,10527 Stone Creek Pl, San Antonio, TX 78254, USA,+1 210-520-9487,http://santexroofing.com/,https://maps.google.com/?cid=10824877852012116630,4.8,roofing_contractor, point_of_interest, establishment, highly recommend Santex Roofing.  They did a great job replacing my roof.  Working with Alonso was a pleasure.  He came out and was able to provide me with an estimate same day.  In less than a week, we had a new roof.  The crew was very efficient and considerate of our needs.  When they were done, they cleaned up so well, you would never know work had just been done.  Easily 5 stars.,We just had our roof beautifully done by Alonso - Tiger and his Santex Crew.  They were proficient, professional & very reasonably priced.  Love the Terra Cotta Color!  💖,I am very pleased and beyond satisfied with Santex roofing. Alfonse was very helpful and went above and beyond in helping me with my situation. He helped me battle the insurance company when they were giving me grief. The workers were very professional and courteous. They picked up after themselves and cleaned up all the debris caused by the roofing work. The delivery guys were very careful in handling my materials. My roof looks absolutely beautiful. If I need a new roof again I will definitely use Santex roofing again and again. I have already recommended Santex to all my family and friends. Debra M.,Santex Roofing finished my roof last week and did a terrific job.  Everyone was extremely professional.  I recommend Santex roofing to anyone who is looking for an exceptional experience, both with workmanship and personnel.  Great job of cleaning up after the job!!!!,Needed our roof repaired from the hail storm of 2016 and Santex roofing was the best decision we made!  The guys were professional, on-time, completed the job in a timely manner and their clean up was exceptional.  They discovered some rotten wood around a vent and repaired it also installed some flashing (should've already been in place) to ensure we do not have any water damage.  Our new roof looks fantastic!  Highly recommend this company for all your roofing needs.
Acme Roofing Co,11549 Old Perrin Beitel Rd, San Antonio, TX 78217, USA,+1 210-646-8340,http://www.acmeroofingcompany.com/,https://maps.google.com/?cid=5778214474827435636,3,roofing_contractor, point_of_interest, establishment,Highly Recommend, dealt with Ray, the owner.  He was friendly, professional, and his crew did great work.  He underbid the other quotes I received by $3K!  To top that off, he did work on our patio that was not even included on the other quotes!   We had recent rain, and no more leaks.  Couldn't ask for more.,Receptionist would not give me a name so i would know who i was speaking to. Very Poor attitude and it would not be a good way to start a business relationship.
San Antonio Roofing Company Inc,6858 Ingram Rd, San Antonio, TX 78238, USA,+1 210-693-1476,,https://maps.google.com/?cid=15637613933480442339,5,roofing_contractor, general_contractor, point_of_interest, establishment, had San Antonio Roofing Company replace my roof a few months ago. They were very professional and very competitive in price.  It has rained quite a bit since then and I have not had one problem.  I would recomend this company to anyone needing a new roof. ,San Antonio Roofing Company installed a new roof on my home in May of 2013. They did a great job and were on time and very professional. I would give them an A+ rating. 
Delta Exteriors: Roofing Company San Antonio,403 E Ramsey Rd Suite 204, San Antonio, TX 78216, USA,+1 210-702-3287,http://deltaexteriorstx.com/,https://maps.google.com/?cid=5554055752866999629,5,roofing_contractor, real_estate_agency, point_of_interest, establishment,xcellent quality and very fast.  Could not be happier!  Highly recommended!  Thank you,They did a great great job with my roof. They were prompt and very well coordinated. I would highly recommend them to anyone looking for roof installation.,Had a 24 gauge metal roof installed it looks great and we couldn't be happier.,He was friendly and constantly in contact with me as the forecast kept changing and we needed two straight days of no rain to replace the roof. His guys arrived early, worked extremely hard and finished the roof mid-day on the second day.,Great company very honest and straight forward people I've enjoyed working with Towsend excellent customer service.
Stephens Roofing & Remodeling,16272 San Pedro Ave, San Antonio, TX 78232, USA,+1 210-785-0994,http://www.stephensroofing.net/,https://maps.google.com/?cid=8451596153964097825,4.3,roofing_contractor, general_contractor, point_of_interest, establishment, don't usually write reviews but I was so impressed with everything about this company. I recently had a stain pop up on my ceiling. My neighbor referred me to Stephen's. When my rep came out she advised I should call my insurance company and have an adjuster come. She later came and met with my insurance adjuster and got them to pay for a full replacement. I received a letter from the office a few days later telling me exactly what to expect. Within a few days I had a brand new roof and no headaches! Long story short I would definitely refer Stephen's Roofing to anyone and everyone!!,We used Stephens Roofing recently to put a metal roof on our house.   We were very satisfied with the the work and effort that was put into the job.  From the sales representative to the Roofing crew, they were very good to us.  We can say we were very pleased and will recommend the company to others.   Thank you again,I highly recommend this company !!! They have worked with me thoroughly in explaining the process and helping me get the best roof for my home. My rep Erica was very kind and polite I felt very comfortable and not pressured to sign anything right away. I would definitely recommend them to anyone that is looking for a new roof.,Erica came out, gave me an estimate and answered every question I had. I went with the company, got my roof put on within 2 weeks and my roof is hands down the most beautiful roof in the entire neighborhood. I couldn't be more impressed. Thank you Stephens roofing!,Stephens Roofing fixed my roof after a huge leak was accuring, they communicated everything from start to finish! I loved their work and would not hesitate to use them again. Thank you guys!
Yuras Roofing,19942 FM 2252, San Antonio, TX 78266, United States,+1 210-651-9249,http://www.yurasroofing.com/,https://maps.google.com/?cid=13186776934362343999,5,roofing_contractor, point_of_interest, establishment,After living in condos and apartments who all seemed to have a roof leak it was very important to us to find a home with a great roof. We did and two months later it was totaled in a hailstorm. Our insurance company gave us a short list and we called two. The first wanted to do the re-roofing but also wanted to scam the insurance and wanted us to go along. The second to assess the roof was Yuras Roofing. They were straightforward, honest and extremely professional. So much attention was paid not only to our new landscape but also to our pets to make sure no nails or debris were left and no plants were damaged. We replaced the roof after another storm many years later and it was another professional expert experience. Twenty-five years later from the first roof and a new house and another new roof.  Beautifully done and again no worries with the company and with owners Joe and Robert. What I haven't mentioned is in all that time we have never had a leak or problem with a Yuras installed roof. So after three roofs and several referrals to friends I can say they are quite simply the very best to trust with your most prized possession. HIGHLY recommend!!!,Great company.  They've repaired my roof on more than one occasion. ,One of the oldest roofing companies around since 1948. Family operated and a family member estimates and inspects each job. The only negative is they only have so many crews. The wait is worth it. Recommended by EVERY insurance adjustor around. 5 year labor warranty and they handle manufacturer warranty claims. The best work at fair prices.,Yuras Roofing completed our roof last week, and we are very pleased with the work done.  We received a thorough, line-by-line quote.  Joe Yuras coordinated the date of the work with us, and his crew arrived promptly, worked diligently, and did a good job.  Highly recommend!!!!
San Antonio Roofing Co,1120 Flagstone Dr, San Antonio, TX 78260, USA,+1 210-341-7663,http://sanantonioroofingcompany.com/,https://maps.google.com/?cid=12252728958417005634,5,roofing_contractor, point_of_interest, establishment,AAA+++ Service
Turner Roofing Co,18953 Redland Rd, San Antonio, TX 78259, USA,+1 210-496-2256,,https://maps.google.com/?cid=3899389720281170198,5,roofing_contractor, point_of_interest, establishment,
Silverado Roofing Services,6303 Gallery Cliff Dr, San Antonio, TX 78249, USA,+1 210-860-2091,http://www.silveradoroofingservices.com/,https://maps.google.com/?cid=13688981074481218792,5,roofing_contractor, point_of_interest, establishment,Great roof replacement in mid range under 20k. They also did a few small updates at no charge, had the entire family out and everyone helped the cleaning up process. I've nothing but good things to say about this company. Hire them and get a family run and family serviced company. I will hire them again for siding work!
Harrison Roofing Co Inc,7825 Mainland Dr, San Antonio, TX 78250, USA,+1 210-545-2332,https://www.harrisonroofingco.com/,https://maps.google.com/?cid=9744030617970025365,5,roofing_contractor, point_of_interest, establishment,
